{
  "type": "object",
  "additionalProperties": false,
  "required": [
    "schema",
    "synthetic",
    "case_id",
    "title",
    "sources"
  ],
  "properties": {
    "schema": {
      "const": "traceharbor.input.v1"
    },
    "synthetic": {
      "const": true
    },
    "case_id": {
      "type": "string",
      "pattern": "^[a-z][a-z0-9_-]{0,63}$"
    },
    "title": {
      "type": "string",
      "minLength": 1,
      "maxLength": 160,
      "pattern": "\\S"
    },
    "sources": {
      "type": "array",
      "items": {
        "$ref": "#/$defs/source"
      },
      "minItems": 1,
      "maxItems": 12
    }
  },
  "$schema": "https://json-schema.org/draft/2020-12/schema",
  "$defs": {
    "event": {
      "type": "object",
      "additionalProperties": false,
      "required": [
        "id",
        "text"
      ],
      "properties": {
        "id": {
          "type": "string",
          "pattern": "^[a-z][a-z0-9_-]{0,63}$"
        },
        "text": {
          "type": "string",
          "minLength": 1,
          "maxLength": 8192,
          "pattern": "\\S"
        },
        "timestamp": {
          "type": [
            "string",
            "null"
          ],
          "maxLength": 40,
          "pattern": "^\\d{4}-\\d{2}-\\d{2}T\\d{2}:\\d{2}:\\d{2}(?:\\.\\d{1,6})?(?:Z|[+-]\\d{2}:\\d{2})$"
        },
        "timestamp_alt": {
          "type": [
            "string",
            "null"
          ],
          "maxLength": 40,
          "pattern": "^\\d{4}-\\d{2}-\\d{2}T\\d{2}:\\d{2}:\\d{2}(?:\\.\\d{1,6})?(?:Z|[+-]\\d{2}:\\d{2})$"
        }
      }
    },
    "source": {
      "type": "object",
      "additionalProperties": false,
      "required": [
        "id",
        "kind",
        "title",
        "events"
      ],
      "properties": {
        "id": {
          "type": "string",
          "pattern": "^[a-z][a-z0-9_-]{0,63}$"
        },
        "kind": {
          "enum": [
            "log",
            "deployment",
            "metric",
            "configuration",
            "runbook",
            "audit"
          ]
        },
        "title": {
          "type": "string",
          "minLength": 1,
          "maxLength": 160,
          "pattern": "\\S"
        },
        "events": {
          "type": "array",
          "items": {
            "$ref": "#/$defs/event"
          },
          "minItems": 1,
          "maxItems": 200
        }
      }
    }
  },
  "description": "Additional runtime limits: 262144 received bytes; 200 total events; unique source/event IDs and JSON keys; valid instants; conservative secret-pattern refusal."
}
