{"case_id":"recovery96-worker-queue","schema":"traceharbor.input.v1","sources":[{"events":[{"id":"q1","text":"pending_jobs=8, completed_jobs_total=144","timestamp":"2031-04-02T12:00:00Z"},{"id":"q2","text":"pending_jobs=27, completed_jobs_total=144","timestamp":"2031-04-02T12:01:00Z"}],"id":"queue67","kind":"metric","title":"Synthetic queue samples"},{"events":[{"id":"w1","text":"active_workers=0, configured_workers=5; recovery96 fixture snapshot has no independent provenance attestation.","timestamp":"2031-04-02T12:00:30Z"}],"id":"workers67","kind":"log","title":"Synthetic worker snapshot"},{"events":[{"id":"a1","text":"A worker reload was requested. No completion acknowledgement was captured; temporal order alone does not establish causation.","timestamp":"2031-04-02T11:59:55Z"}],"id":"audit67","kind":"audit","title":"Synthetic reload event"}],"synthetic":true,"title":"Synthetic recovery96 worker snapshot and queued jobs after a reload"}